{
  "$schema": "https://github.com/Emily2040/seedance-2.0/schemas/scene-ir-v2.schema.json",
  "schema_version": 2,
  "state_binding": {
    "project_id": "migration_watch",
    "clip_id": "clip_01",
    "state_revision": 1,
    "canon_revision": 1,
    "semantic_state_sha256": "aaaaaaaaaaaaaaaaaaaaaaaaaaaaaaaaaaaaaaaaaaaaaaaaaaaaaaaaaaaaaaaa",
    "planned_start_snapshot_sha256": "bbbbbbbbbbbbbbbbbbbbbbbbbbbbbbbbbbbbbbbbbbbbbbbbbbbbbbbbbbbbbbbb",
    "planned_end_snapshot_sha256": "cccccccccccccccccccccccccccccccccccccccccccccccccccccccccccccccc",
    "completed_beat_ids": ["beat_before"],
    "current_beat_ids": ["beat_line", "beat_reaction"],
    "reserved_future_beat_ids": ["beat_after"]
  },
  "take_structure": "edited_multi_shot",
  "timing_policy": "ordered_phases",
  "entities": [
    {
      "entity_id": "detective",
      "label": "the detective",
      "kind": "character",
      "stable_features": ["dark raincoat"]
    },
    {
      "entity_id": "woman",
      "label": "the woman",
      "kind": "character",
      "stable_features": ["red scarf"]
    },
    {
      "entity_id": "station",
      "label": "the station platform",
      "kind": "environment",
      "stable_features": ["wet concrete and cool overhead lights"]
    }
  ],
  "materials": [],
  "speakers": [
    {
      "speaker_id": "detective_voice",
      "entity_id": "detective",
      "role": "onscreen_character",
      "display_name": "Detective",
      "voice": {
        "mode": "generic_synthetic",
        "authority_target_id": null,
        "asset_id": null,
        "authorization_status": "not_applicable",
        "attestation_sha256": null
      }
    }
  ],
  "shots": [
    {
      "shot_id": "shot_01",
      "shot_index": 1,
      "opening_event_id": "shot_01_open",
      "endpoint_event_id": "shot_01_end",
      "events": [
        {
          "event_id": "shot_01_open",
          "event_index": 1,
          "phase": "opening_state",
          "actor_ids": ["detective"],
          "target_ids": ["woman", "station"],
          "depends_on": [],
          "visible_state_change": "The detective faces the woman beneath the platform light.",
          "beat_ids": ["beat_line"],
          "interaction_kind": "none",
          "material_ids": []
        },
        {
          "event_id": "shot_01_end",
          "event_index": 2,
          "phase": "endpoint",
          "actor_ids": ["detective"],
          "target_ids": ["woman"],
          "depends_on": ["shot_01_open"],
          "visible_state_change": "The detective finishes the line while holding eye contact.",
          "beat_ids": ["beat_line"],
          "interaction_kind": "non_material_state_change",
          "material_ids": []
        }
      ],
      "camera": {
        "move_kind": "locked",
        "start_framing": "A stable medium close-up of the detective.",
        "path": "The camera does not translate or rotate.",
        "speed": "static",
        "subject_relationship": "The detective's mouth remains unobstructed.",
        "endpoint_framing": "The same stable medium close-up.",
        "observed_event_ids": ["shot_01_open", "shot_01_end"],
        "occlusion_risks": [],
        "mitigations": []
      }
    },
    {
      "shot_id": "shot_02",
      "shot_index": 2,
      "opening_event_id": "shot_02_open",
      "endpoint_event_id": "shot_02_end",
      "events": [
        {
          "event_id": "shot_02_open",
          "event_index": 1,
          "phase": "opening_state",
          "actor_ids": ["woman"],
          "target_ids": ["detective", "station"],
          "depends_on": [],
          "visible_state_change": "The cut reveals the woman still facing the detective.",
          "beat_ids": ["beat_reaction"],
          "interaction_kind": "none",
          "material_ids": []
        },
        {
          "event_id": "shot_02_end",
          "event_index": 2,
          "phase": "endpoint",
          "actor_ids": ["woman"],
          "target_ids": ["detective"],
          "depends_on": ["shot_02_open"],
          "visible_state_change": "The woman answers with a restrained half-smile.",
          "beat_ids": ["beat_reaction"],
          "interaction_kind": "non_material_state_change",
          "material_ids": []
        }
      ],
      "camera": {
        "move_kind": "locked",
        "start_framing": "A stable medium close-up of the woman.",
        "path": "The camera does not translate or rotate.",
        "speed": "static",
        "subject_relationship": "The woman's reaction remains unobstructed.",
        "endpoint_framing": "The same stable medium close-up.",
        "observed_event_ids": ["shot_02_open", "shot_02_end"],
        "occlusion_risks": [],
        "mitigations": []
      }
    }
  ],
  "transitions": [
    {
      "transition_id": "cut_01_02",
      "transition_index": 1,
      "from_shot_id": "shot_01",
      "to_shot_id": "shot_02",
      "transition_type": "hard_cut",
      "from_event_id": "shot_01_end",
      "to_event_id": "shot_02_open",
      "beat_ids": ["beat_reaction"],
      "preserved_invariant_ids": ["platform_continuity"],
      "allowed_change_event_ids": ["shot_02_open", "shot_02_end"],
      "audio_bridge_event_ids": ["platform_ambience"]
    }
  ],
  "audio_events": [
    {
      "audio_event_id": "detective_line",
      "audio_event_index": 1,
      "semantic_function": "dialogue",
      "shot_ids": ["shot_01"],
      "beat_ids": ["beat_line"],
      "source_entity_ids": ["detective"],
      "timing": {
        "mode": "visual_event_window",
        "start_event_id": "shot_01_open",
        "end_event_id": "shot_01_end",
        "cue_event_id": null,
        "beat_label": null,
        "start_seconds": null,
        "end_seconds": null,
        "evidence_claim_ids": []
      },
      "description": "The detective delivers one short line in a low, controlled voice.",
      "speech": {
        "speaker_id": "detective_voice",
        "spoken_language": "en",
        "utterance": "I found it.",
        "utterance_sha256": "7a3610a72b4915d3cd7c0932053fd81430c57b5bfb30c02b6f887bd8d4cf3b73",
        "turn_index": 1,
        "overlap_policy": "no_overlap",
        "lip_sync": "required",
        "delivery_intent": "Low, controlled, and clearly articulated."
      }
    },
    {
      "audio_event_id": "platform_ambience",
      "audio_event_index": 2,
      "semantic_function": "ambience",
      "shot_ids": ["shot_01", "shot_02"],
      "beat_ids": ["beat_line", "beat_reaction"],
      "source_entity_ids": ["station"],
      "timing": {
        "mode": "continuous_sequence",
        "start_event_id": null,
        "end_event_id": null,
        "cue_event_id": null,
        "beat_label": null,
        "start_seconds": null,
        "end_seconds": null,
        "evidence_claim_ids": []
      },
      "description": "Low platform room tone and distant rain continue across the cut.",
      "speech": null
    }
  ],
  "subtitle_policy": {
    "mode": "post_subtitles",
    "target_language_tags": ["en"],
    "picture_policy": "clean_picture"
  },
  "requested_invariants": [
    {
      "invariant_id": "platform_continuity",
      "entity_ids": ["detective", "woman", "station"],
      "description": "Wardrobe, eyelines, platform lighting, and rain remain continuous across the cut."
    }
  ],
  "known_fragilities": [
    {
      "fragility_id": "speech_and_cut",
      "event_ids": ["shot_01_end", "shot_02_open"],
      "audio_event_ids": ["detective_line", "platform_ambience"],
      "transition_ids": ["cut_01_02"],
      "description": "Review exact speech, lip sync, ambience continuity, and the edit boundary separately."
    }
  ],
  "acceptance_tests": [
    {
      "acceptance_id": "review_av_sequence",
      "event_ids": ["shot_01_end", "shot_02_end"],
      "audio_event_ids": ["detective_line", "platform_ambience"],
      "transition_ids": ["cut_01_02"],
      "observable": "Both shot endpoints, the exact line, the ambience bridge, and the hard cut are reviewable.",
      "pass_condition": "The line is assigned to the detective and intelligible, ambience continues across one hard cut, and both endpoints are reached."
    }
  ],
  "post_fallbacks": [
    {
      "fallback_id": "post_dub_if_needed",
      "trigger_acceptance_ids": ["review_av_sequence"],
      "action": "If exact speech or lip sync fails, keep the clean picture and route the line to an authorized post dub."
    }
  ]
}
